,phrase,sig_label1387, of the students,11388,the trumpet section. of the students,11389,Melanie. Sara catches trout. Melanie catches,11390,trout. Melanie catches times as many,11391,Jose gives to Alan. If,11392,Jose started with how much money,11393,There are pencils in the,11394,. Nancy placed pencils in the,11395,week Tim had dollars and Keith,11396,and now has dollars . How,11397,Fred weighs pounds. Kathryn weighs,11398,pounds. Kathryn weighs pounds. How much,11399,Shirley starts with eggs. She buys,11400,eggs. She buys more. How many,11401,Sara had peaches and 37,11402,There are now peaches . how,11403,There are stickers in each,11404,There are stickers in each,11405,There are cards in Jean's,11406,"are organized into groups, how big",11407,Janet has boxes of candies.,11408,Each box holds candies. How many,11409,Mildred has with blocks. Mildred finds,11410,Mildred finds another How many blocks,11411,Sally picked lemons and Mary,11412,and Mary picked lemons from the,11413,Betty has oranges stored in,11414,"If there are boxes, how many",11415,wood that was centimeters long. Then,11416,Then he sawed centimeters off the,11417,It took Carl hours to ride,11418,Ralph's house at miles per hour.,11419,Philip starts with oranges. He finds,11420,He finds another How many oranges,11421,There were boys and num1,11422,num2 boys and girls on the,11423,"clarinet for $ , and a",11424,which was $ . Dan found,11425,recipe calls for cups of sugar.,11426,recipe calls for cups of sugar.,11427,There are walnut trees currently,11428,workers will plant more walnut trees,11429,Megan had markers. Robert gave,11430,Robert gave her more markers. How,11431,Edward starts with eggs. He gives,11432,eggs. He gives to Phillip. How,11433,a speed of miles an hour.,11434,she bike in hours?,11435,"sale, Victor used of a scoop",11436,as well as of a scoop,11437,to the store times last month.,11438,month. She buys bananas each time,11439,Mikey had leaves. Some of,11440,Now she has leaves left. How,11441,Mary picked oranges and Jason,11442,and Jason picked oranges from the,11443,Each child has eggs. If there,11444,"If there are children, how many",11445,Ernest starts with crayons. Jennifer takes,11446,crayons. Jennifer takes away. How many,11447,Betty also bought shiny blue round,11448,round stones. If pieces of this,11449,There are calories in a,11450,are there in candy bars ?,11451,'s dog had puppies and num3,11452,num2 puppies and had spots .,11453,num2 puppies and had spots .,11454,Karen has crayons. Cindy has,11455,crayons. Cindy has crayons. How many,11456,during lunch. Only were actually served.,11457,during lunch. Only were actually served.,11458,IsabellaŒŠí_ŒÈs hair is inches long. By,11459,her hair is inches long. How,11460,Theresa has eggs. Daniel has,11461,eggs. Daniel has eggs. If Daniel,11462,If there are cards in a,11463,"and Lori puts more cards inside,",11464,Evelyn starts with marbles. She gets,11465,marbles. She gets more from Michelle.,11466,James rode miles at num3,11467,num1 miles at miles per hour.,11468,trip. There are students and num3,11469,num1 students and seats on each,11470,Jacqueline removes apples from a,11471,There were originally apples in the,11472,Martha has peanuts. Joyce has,11473,peanuts. Joyce has peanuts. If Joyce,01474,Sara collects pencils. Sara's father,11475,father gives Sara more. How many,11476,David has and Teresa has,11477,and Teresa has How much money,11478,There are walnut trees currently,11479,workers will plant more walnut trees,11480,Jessica weighs pounds. Thomas weighs,11481,pounds. Thomas weighs pounds. How much,11482,"gross pay is dollars , while",11483,"net pay is dollars , how",11484,Sally had peaches at her,11485,There are now peaches . how,11486,"Vacation Wear , the garments are",11487,are bikinis and are trunks .,11488,needed to serve of a can,11489,a total of of a can,11490,Norma has cards. She loses,11491,cards. She loses How many cards,11492,Kelly has Nintendo games. How,11493,Kelly will have games left?,11494,Evelyn starts with bottle caps. She,11495,She finds another How many bottle,11496,juggler is juggling balls at a,11497,if there are jugglers putting a,11498,Mrs. Sheridan has fish. Her sister,11499,sister gave her more fish. How,11500,There are bottle caps in,11501,"are organized into groups, how big",11502,John starts with and spends $num2,11503,$num1 and spends on erasers. How,11504,Louis has boxes of bottle,11505,Each box holds bottle caps. How,11506,It takes feet of cotton,11507,be made with feet of material?,11508,able to collect paper clips. If,11509,"paper clips in boxes, how many",11510,Patrick has and Joan has,11511,and Joan has How much money,11512,Harold has marbles. He gets,11513,marbles. He gets more from Steve.,11514,"If Karen sold boxes of Tagalongs,",11515,many cases of boxes does Karen,11516,needs to share equally among num3,11517,$num1 equally among total people. How,11518,Larry starts with cards. num3 are,11519,with num2 cards. are eaten by,11520,Ruby has apples. Emily takes,11521,apples. Emily takes away. How many,11522,There are rose bushes currently,11523,workers will plant more rose bushes,11524,If there are peanuts in a,11525,"and Justin puts more peanuts inside,",11526,Joe has oranges that must,11527,"If there are boxes, how many",11528,Stephen has Skittles. He finds,11529,He finds another How many Skittles,11530,some blocks for Elizabeth has $num1,11531,"$num2, Elizabeth has left. How much",11532, of HayleyŒŠí_ŒÈs closest,11533,if she has stickers?,11534,Ryan has marbles and 17,11535,"the marbles among friends, how many",11536,Mrs. Sheridan has cats. Mr. Sheridan,11537,Sheridan gave her more cats. How,11538,Albert starts with and spends $num1,11539,$num3 and spends on eggs. How,11540,Louise has boxes of pencils.,11541,Each box holds pencils. How many,11542,Kelly bought pounds of peanuts,11543,of peanuts and pounds of raisins,11544,some bananas for Craig has $num2,11545,"$num1, Craig has left. How much",11546,Laura gives to Paul. If,11547,Laura started with how much money,11548,Emily has and Gary has,11549,and Gary has How much more,11550,some peanuts for Irene has $num2,11551,"$num1, Irene has left. How much",11552,a book with pages. If you,11553,to finish in days?,11554,to the store times last month.,11555,month. He buys peanuts each time,11556,If Heather bicycled kilometers at num1,11557,"num3 kilometers at kilometers per hour,",11558,Sean has whistles. Sean has,11559,whistles. Sean has more whistles than,11560,Lisa flew miles at num1,11561,num2 miles at miles per hour.,11562,Kathy removes Skittles from a,11563,There were originally Skittles in the,11564,Keith each have Pokemon cards. How,11565,Steve starts with and spends $num2,11566,$num3 and spends on blocks. How,11567,"If Karen sold boxes of Tagalongs,",11568,many cases of boxes does Karen,11569,Stanley ran mile and walked,11570,mile and walked mile . How,11571,Our class got books from the,11572,Then we got more books from,11573,fish that was foot long and,11574,fish that was foot long .,11575,Jose starts with bottle caps. He,11576,caps. He gets more from Rebecca.,11577,Nancy has five dollars bills.,11578,Fred grew cantelopes . Tim,11579,. Tim grew cantelopes . How,11580,Fred earns an hour cleaning,11581,"he works for hours, how much",11582,"first act included clown mobiles, each",11583,each stuffed with clowns. How many,11584,Ernest has bottle caps. He,11585,caps. He buys more. How many,11586,There are apples. num16 apples,11587,are num1 apples. apples more are,01588,There are oranges in each,11589,oranges are in boxes ?,11590,a bakery used bag of wheat,11591,wheat flour and bag of white,11592,There are books on the,11593,shelf. Marta put more books on,11594,A total of people attended the,11595,"concert, which had more people in",11596,Fred had dimes in his,11597,His sister borrowed of his dimes,11598,Helen starts with oranges. She gets,11599,Helen starts with oranges. She gets,11600,Janet starts with oranges. She gives,11601,oranges. She gives to Lois. How,11602,needed to serve can of cat,11603,a total of can each day,11604,There are tickets in each,11605,tickets are in boxes ?,11606,Kenny used exactly cup of oil,11607,of oil and cups of water,11608,There are oak trees currently,11609,to cut down oak trees that,11610,Anna collects blocks. Anna's father,11611,father gives Anna more. How many,11612,Alice has and Steve has,11613,and Steve has How much money,11614,If there are peanuts in a,11615,"and Deborah puts more peanuts inside,",11616,Cheryl has pencils. She loses,11617,pencils. She loses How many pencils,11618,Jason grew watermelons and 22,11619,. Dan grew watermelons . How,11620,The theater has seats. How many,11621,Bobby ate pieces of candy.,11622,"Then, he ate more. How many",11623,Aaron has boxes of pencils.,11624,Each box holds pencils. How many,11625,Ruby has candies. She loses,11626,candies. She loses How many candies,11627,Kelly has Nintendo games. How,11628,she will have games left?,11629,Sally earns an hour cleaning,11630,"she works for hours, how much",11631,IshaŒŠí_ŒÈs pencil is inches long. If,11632,her pencil is inches long. How,11633,a bag of nails as they,11634,they left exactly nails in every,11635,Tim has dozen golf balls.,11636,Douglas has and Barbara has,11637,and Barbara has How much money,11638,Marlee has guests coming to,11639,table will hold guests. How many,11640,Sally paid $ total for peaches,11641,", and $ for cherries .",11642,Each cup contains ounces. How many,11643,ounces are in cups?,11644,Bobby has Skittles. He gives,11645,Skittles. He gives to Victor. How,11646,Sally has orange balloons and,11647,. She lost of the orange,11648,Each egg costs How much do,11649,How much do eggs cost ?,11650,Yardley it snowed inch in the,11651,the morning and inch in the,11652,Sally had quarters in her,11653,bank. She spent of her quarters.,11654,Jovana had pounds of shells,11655,and now has pounds of shells.,11656,A sandbox is centimeters long and,11657,centimeters long and centimeters wide. How,11658,decreased by $ . If her,11659,"was worth $ before , how",11660,Each child has eggs. If there,11661,Each child has eggs. If there,11662,Keith has books . Jason,11663,. Jason has books . How,11664,a bucket with of a gallon,11665,he poured out of a gallon,11666,Susan has crayons. She loses,11667,crayons. She loses How many crayons,11668,Gloria gives to Louis. If,11669,Gloria started with how much money,11670,that she had box of baking,11671,now down to box . How,11672,potluck. Omar rolled egg rolls. Karen,11673,rolls. Karen rolled egg rolls. What,11674,Anthony removes oranges from a,11675,There were originally oranges in the,11676,combined total of grams of jelly,11677,If they have grams of blueberry,11678,that she had of a box,11679,now down to of a box.,11680,Charles has apples. Jessica gives,11681,Jessica gives Charles more. How many,11682,Bonnie has tickets. If she,11683,"shares them among friends, how many",11684,If Teresa jogged kilometers at num2,11685,"num3 kilometers at kilometers per hour,",11686,Dan found seashells on the,11687,. He has seashell . How,11688,Each child has pencils. If there,11689,"If there are children, how many",11690,Juan starts with eggs. He shares,11691,eggs. He shares with Harry. How,11692,combined total of pounds of fresh,11693,they have sold pounds of frozen,11694,Gloria has pencils. Lisa has,11695,pencils. Lisa has pencils. If Lisa,11696,Each ticket costs How much do,01697,How much do tickets cost?,11698,Melanie grew turnips. Benny grew,11699,turnips. Benny grew turnips. How many,11700,Benny bought dozen eggs from,11701,Gavin has shirts. num1 are,11702,has num2 shirts. are blue the,11703,There are eggs in a,11704,box. Harry takes eggs. How many,11705,some Skittles for Patricia has $num3,11706,"$num1, Patricia has left. How much",11707,week Tom had dollars. He washed,11708,and now has dollars. How much,11709,Jennifer has cards. num1 are,11710,has num2 cards. are eaten by,11711,Joshua has bottle caps. He,11712,caps. He buys more. How many,11713,There were kids on the,11714,the soccer field. kids decided to,11715,fountain. It was feet. How many,11716,the water fountain times today?,11717,Henry has and Lawrence has,11718,and Lawrence has How much money,11719,Louise has and Nicholas has,11720,and Nicholas has How much money,11721,Brian has cards. Wayne takes,11722,cards. Wayne takes away. How many,11723,in packages of If Mom buys,11724,"If Mom buys packages, how many",11725,Alyssa each have baseball cards. How,11726,Melanie picked plums and 4,11727,. She gave plums to Sam,11728,Martha weighs pounds. Roger weighs,11729,Martha weighs pounds. Roger weighs,11730,an aquarium with fish. Lucy wants,11731,wants to buy more fish. How,11732,Joan went to football games this,11733,She went to games last year,11734,There are candies in each,11735,candies are in boxes ?,11736,Sandy grew pumpkins. Mike grew,11737,pumpkins. Mike grew pumpkins. How many,11738,Janet removes pencils from a,11739,There were originally pencils in the,11740,Justin gives to Jeremy. If,11741,Justin started with how much money,11742,Kenneth has marbles. He buys,11743,"marbles. He buys more. Later, Kenneth",11744,some peanuts for Willie has $num2,11745,"$num3, Willie has left. How much",11746,You have balloons and your,11747,your friend has balloons. How many,11748,Louis starts with oranges. He finds,11749,He finds another How many oranges,11750,Joan has blue balloons but,11751,balloons but lost of them. How,11752,the day with buckets of seeds,11753,she now has buckets . How,11754,with numnum3 Skittles. are eaten by,11755,with numnum3 Skittles. are eaten by,11756,"'s airport , passengers landed on",11757,". Unfortunately , passengers landed late",11758,"costs a bookstore dollars , and",11759,sells it for dollars. Find the,11760,Connie has red markers and,11761,red markers and blue markers. How,11762,some crayons for Cheryl has $num3,11763,"$num1, Cheryl has left. How much",11764,tickets. He buys more. How many,11765,tickets. He buys more. How many,11766,to the store times last month.,11767,month. He buys bottle caps each,11768,Diana has erasers. If she,11769,"shares them among friends, how many",11770,", Sam poured bucket of water",11771,he added another buckets . How,11772,Willie has bananas. Charles has,11773,bananas. He loses How many bananas,11774,Joyce has boxes of Skittles.,11775,Each box holds Skittles. How many,01776,Sara has golf balls. How,11777,7 pennies and dimes in his,11778,His sister borrowed dimes . How,11779,week Pat had stickers. Pat earned,11780,stickers. Pat earned more during the,11781,Tyler had dogs. Each dog,11782,Each dog had puppies. How many,11783,If Victor split Skittles between num2,11784,num3 Skittles between people in her,11785,Ryan has and Fred has,11786,and Fred has How much money,11787, children are taking,11788,zoo. They sit children in every,11789,Fred has baseball cards. Keith,11790,cards. Keith bought of Fred's baseball,11791,There are scissors and 3,11792,. Jason placed scissors in the,11793,Jessica spent $ on a cat,11794,cost her $ . What was,11795,it only had algae plants .,11796,"Now there are algae plants ,",11797,Mrs. Hilt uses ounces of detergent,11798,use to wash pounds of clothes?,11799,Willy has crayons. Lucy has,11800,crayons. Lucy has crayons. How many,11801,some Skittles for Christine has $num3,11802,"$num2, Christine has left. How much",11803,There are pencils in the,11804,. Tim placed pencils in the,11805,a total of loaf of wheat,11806,wheat bread and loaf of white,11807,Skittles. He gives to Nathan. How,11808,Skittles. He gives to Nathan. How,11809,There are oranges in a,11810,bag. Susan takes oranges out of,11811,There is of a cup,11812,If Scarlett adds of a cup,11813,an aquarium with fish. She wants,11814,wants to buy more fish. How,11815,of iron weighed pounds and the,11816,of aluminum weighed of a pound.,11817,49 pennies and nickels in his,11818,dad gave him nickels and 31,11819,to school is mile and Zachary,11820,bus ride is mile . How,11821,a tower with blocks. He added,11822,now he has blocks. How many,11823,Each card costs How much do,11824,How much do cards cost ?,11825,Joan found seashells on the,11826,she gave Mike of the seashells.,11827,There are oranges in a,11828,box. Jonathan takes oranges. How many,11829,If there are bottle caps in,11830,If there are bottle caps in,11831,Sara has black and 122,11832,. Fred took of Sara 's,11833, of a number,11834,"a number is , what is",11835,Melissa has and Richard has,11836,and Richard has How much money,11837,cards. Benny bought of Jason's Pokemon,11838,cards. Benny bought of Jason's Pokemon,11839,James has balloons. Amy has,11840,balloons. Amy has balloons. How many,11841,"the hardware store, of the nails",11842,size 2d and of the nails,11843,Mary has yellow marbles Joan,11844,marbles Joan has yellow marbles. How,11845,There are cards. num2 cards,11846,are num3 cards. cards more are,11847,Terrell hiked miles on Saturday,11848,he hiked another miles . How,11849,There are short trees and,11850,workers will plant short trees today,11851,Lukas averages points per game,11852,he score in games?,11853,Ashley has and Betty has,11854,and Betty has How much more,11855,Anne wandered for hours at num2,11856,num3 hours at miles per hour.,11857,Paula has boxes of oranges.,11858,Each box holds oranges. How many,11859,some candies for Richard has $num3,11860,"$num2, Richard has left. How much",11861,Jeremy strolled kilometers at num1,11862,num3 kilometers at kilometers per hour.,11863,"This year , male and num3",11864,num2 male and female salmon returned,11865,to the store times last month.,11866,month. She buys pencils each time,11867,Brenda starts with Skittles. She buys,11868,Skittles. She buys more. How many,11869,Cheryl starts with Skittles. Kathryn gives,11870,Kathryn gives Cheryl more. How many,01871,Sean has apples. Susan gives,11872,"Susan gives Sean more. Later, Sean",11873,"Susan gives Sean more. Later, Sean",11874,Teresa starts with bananas. She gets,11875,bananas. She gets more from Rachel.,11876,farmer Cunningham 's lambs is either,11877,. There are white ones .,11878,Sam has blue and 25,11879,. Alyssa has blue balloons .,11880,Sara has green and 5,11881,. Tom has green marbles .,11882,bee colony produced pounds of honey,11883,but bears ate pounds of it,11884,Anne has with bottle caps. Anne,11885,Anne finds another How many bottle,11886,There are erasers in a,11887,box. Katherine takes erasers. How many,11888, people are watching,11889,The theater has seats. How many,11890,", there were houses in Lawrence",11891,", there are houses . How",11892,Jack starts with marbles. He shares,11893,marbles. He shares with Rebecca. How,11894,Connie has marbles. Juan has,11895,marbles. Juan has more marbles than,11896,James rode miles at num3,11897,num1 miles at miles per hour.,11898,team and ran laps per minute.,11899,Johnny to run laps?,11900,"numnum2 miles at miles per hour,",11901,"numnum2 miles at miles per hour,",11902,William has bottle caps. He,11903,caps. He buys more. How many,11904,Tim has books. Sam has,11905,books. Sam has books. How many,11906,a tree limb. more toucan joins,11907,a tree limb. more toucan joins,11908,Sandy had pet fish. She,11909,fish. She bought more fish. How,11910,are numnum1 blocks. blocks more are,11911,are numnum1 blocks. blocks more are,11912,Josh had marbles in his,11913,collection. He lost marbles. How many,11914,salon and had of an inch,11915,asked for another of an inch,11916,A restaurant sold hamburgers last week.,11917,Anne has boxes of apples.,11918,Each box holds apples. How many,11919,There are erasers and 118,11920,. Jason placed erasers in the,11921,Paco had cookies. Paco ate,11922,cookies. Paco ate of them. How,11923,Convert to a percent.,11924,If there are oranges in a,11925,"and Amanda puts more oranges inside,",11926,Carol has and George has,11927,and George has How much money,11928,A total of people attended the,11929,"concert, which had more people in",11930,A bee has legs. How many,11931,many legs do bees have?,11932,recipe calls for cup of diced,11933,used to make of this recipe.,11934,Janice has candies. She buys,11935,candies. She buys more. How many,11936,Gregory starts with and spends $num2,11937,$num3 and spends on Skittles. How,11938,There are walnut trees currently,11939,workers will plant walnut trees today,11940,"skateboard for $ , and spent",11941,and spent $ on marbles .,11942,If there are oranges in a,11943,"and Steve puts more oranges inside,",11944,"Dan has violet marbles ,",11945,he gave Mary of the marbles,11946,There are blocks. num3 blocks,11947,are num2 blocks. blocks more are,11948,trip. There are students and num2,11949,num3 students and seats on each,11950,. It covers acres of the,11951,", but leaves acres untouched .",11952,Dan grew turnips and 38,11953,. Jessica grew turnips . How,11954, boats are in,11955,Each boat has people. How many,11956,There are candies in a,11957,box. Thomas takes candies. How many,11958,Mike has books in his,11959,He now has books in his,11960,Tom went to hockey games this,11961,He went to games last year,11962,some erasers for William has $num2,11963,"$num1, William has left. How much",11964,Sam went to football games this,11965,He went to games last year,11966,There are apples in a,11967,package of 7. apples are added,11968,Maria has boxes of eggs.,11969,Each box holds eggs and there,11970,"rode the bus miles , and",11971,and then walked mile to get,11972,Eric has boxes of pencils.,11973,Each box holds pencils. How many,11974,cake recipe requires cup of sugar,11975,the frosting and cup of sugar,11976,that there are sections for the,11977,"section can accommodate people, how many",01978,A bucket contains gallons of water,11979,"If Derek adds gallons more ,",11980,some blocks for Lois has $num2,11981,"$num1, Lois has left. How much",11982,Jason had quarters in his,11983,dad gave him more quarters. How,11984,Mrs. Hilt ate apples every hour.,11985,the end of hours?,11986,that she has crayons which she,11987,box can contain crayons. How many,11988,party. You buy pizzas. Each pizza,11989,Each pizza has slices. How many,11990,Debra removes apples from a,11991,There were originally apples in the,11992,Kimberly has Skittles. She buys,11993,"Skittles. She buys more. Later, Kimberly",11994,Each sticker costs How much do,11995,How much do stickers cost ?,11996,Walter starts with blocks. He loses,11997,blocks. He loses How many blocks,11998,in packages of Louis ate num1,11999,num3. Louis ate Lemon Heads. How,12000,Steve gave him more pieces of,12001,Now Todd has pieces of gum.,12002,Arthur removes pencils from a,12003,There were originally pencils in the,12004,Tessa has apples. Anita gave,12005,Anita gave her more. She needs,12006,Darnel sprinted lap and then,12007,break by jogging lap . How,12008,marbles. Connie gave to Juan. Now,12009,Now Connie has marbles left. How,12010,supply will be metric tons and,12011,will be only of the world,12012,Aaron has and Gregory has,12013,and Gregory has How much money,12014,Douglas has bottle caps. Joan,12015,caps. Joan takes away. How many,12016,There are pencils in the,12017,. Mike placed pencils in the,12018,There were girls and num2,12019,num1 girls and boys on the,12020,Sarah picked apples. Her brother,12021,Her brother picked apples. How many,12022,Scott has and Andrea has,12023,and Andrea has How much money,12024,Gordon bought pounds of fruit,12025,The class ate pounds of the,12026,of pants is dollars. If the,12027,the store paid dollars less for,12028,Jean starts with Skittles. She shares,12029,Skittles. She shares with Rebecca. How,12030,green caterpillar was inches long and,12031,orange caterpillar was inches long. How,12032,Mrs. Santiago has red roses. Mrs.,12033,Mrs. Garrett has How many more,12034,Joan has books. Tom has,12035,books. Tom has books. How many,12036,Misha has dollars. How many,12037,earn to have dollars to buy,12038,high school played soccer games this,12039,year. She attended games. How many,12040,Annie starts with crayons. Matthew gives,12041,Matthew gives Annie more. How many,12042,Sara picked pears and Sally,12043,and Sally picked pears from the,12044,for admission and dollars to rent,02045,of skates for dollars. How many,12046,Nathan has tickets. He buys,12047,tickets. He buys more. How many,12048,her bucket with pounds of shells.,12049,If she adds more pounds of,12050,Gloria starts with apples. She shares,12051,apples. She shares with Willie. How,12052,There are oranges. num3 oranges,12053,There are oranges. num3 oranges,12054,There are pigs in the,12055,Now there are pigs. How many,12056,Louis has erasers. Julie has,12057,erasers. Julie has erasers. If Julie,12058,Louis has boxes of bottle,12059,Each box holds bottle caps. How,12060,Sara picked pears and 27,12061,. She gave pears to Dan,12062,Dorothy has bananas. Gloria has,12063,bananas. Gloria has bananas. If Gloria,12064,The farmer had apples. He gave,12065,apples. He gave apples to his,12066,Christina starts with crayons. She finds,12067,She finds another How many crayons,12068,A restaurant made hamburgers to serve,12069,lunch . Only were actually served,12070,basketball team is inches tall. This,12071,tall. This is inches taller than,12072,If there are oranges in a,1