,phrase,sig_label2073,"and Steve puts more oranges inside,",12074,made cookies for If she prepared,12075,If she prepared cookies and each,12076,CindyŒŠí_ŒÈs mom baked cookies. PaulŒŠí_ŒÈs dad,12077,PaulŒŠí_ŒÈs dad baked cookies. They both,12078,. Benny bought of Jason 's,12079,. Benny bought of Jason 's,12080,Joyce starts with and spends $num2,12081,$num1 and spends on crayons. How,12082,to the store times last month.,12083,month. She buys apples each time,12084,Willie has and Joshua has,12085,and Joshua has How much money,12086,Mike found seashells and num1,12087,"num2 seashells and starfish , but",12088,"num2 seashells and starfish , but",12089, birds were sitting,12090,in a tree. more birds flew,12091,Wendy ran miles and walked,12092,miles and walked miles . How,12093,"day, Sam poured bucket of water",12094,he added another buckets. How much,12095,"yesterday, I found frisky fleas having",12096,right ear and baby fleas sleeping,12097,a total of tickets last season,12098,If they sold tickets in the,12099,wood that was meters long. Then,12100,Then she sawed meters off the,12101,numnum2 birds and nests. How many,12102,numnum2 birds and nests. How many,12103,Cade had marbles. He gave,12104,marbles. He gave to Dylan. How,12105,a bucket with of a gallon,12106,she realized only of a gallon,12107,If there are peanuts in a,12108,"and Justin puts more peanuts inside,",12109,'s zoo eats bucket of trout,12110,of trout and bucket of salmon,12111,pounds. Mary weighs pounds. How much,12112,pounds. Mary weighs pounds. How much,12113,There are candies in a,12114,package of 15. candies are added,12115,Jason has books and he,12116,. Mary has books . How,12117,a bakery used of a bag,12118,wheat flour and of a bag,12119,bottle cap costs How much do,02120,How much do bottle caps cost?,12121,Kyoko pay for balls?,12122,Kyoko pay for balls?,12123,There are marbles. num1 marbles,12124,are num3 marbles. marbles more are,12125,Benny received dollars for his,12126,". He had dollars over ,",12127,a total of customers across the,12128,world . If of its customers,12129,a total of of a loaf,12130,wheat bread and of a loaf,12131,Benny has blue marbles. Keith,12132,marbles. Keith has times more blue,12133,Lawrence weighs pounds. Rebecca weighs,12134,pounds. Rebecca weighs pounds. How much,12135,Keith grew turnips . Alyssa,12136,. Alyssa grew turnips . How,12137,Sally grew carrots. Fred grew,12138,carrots. Fred grew carrots. How many,12139,Russell starts with and spends $num2,12140,$num3 and spends on erasers. How,12141,Alyssa picked plums and Jason,12142,and Jason picked plums . Melanie,12143,A garden has rows and num2,12144,num1 rows and columns of bean,12145,If there are erasers in a,12146,"and Daniel puts more erasers inside,",12147,Sara had quarters in her,12148,dad gave her more quarters. How,12149,There are eggs in each,12150,eggs are in boxes ?,12151,of books weighs pounds. Each book,12152,Each book weighs pounds. How many,12153,Jason has violet balloons and,12154,. He lost of the violet,12155,Janice has and Andrew has,12156,and Andrew has How much more,12157,Denise removes bananas from a,12158,There were originally bananas in the,12159,zoo. There are cars to take,12160,zoo. There are cars to take,12161,There are pots. Each pot,12162,Each pot has flowers in it.,12163,Denise has eggs. Dennis has,12164,eggs. Dennis has eggs. If Dennis,02165,family took a day vacation by,12166,day they drove miles. How many,02167,Norma removes erasers from a,12168,There were originally erasers in the,12169,Diane has crayons. She gets,12170,crayons. She gets more from Frances.,12171,Michelle has boxes of crayons.,12172,Each box holds crayons. How many,12173,It rained inches on Monday,12174,", it rained inches less than",12175,Each bag contains pounds of oranges.,12176,oranges are in bags?,12177,There were bales of hay,12178,There are now bales of hay,12179,Benjamin weighs pounds. Craig weighs,12180,pounds. Craig weighs pounds. How much,12181,There are stickers in a,12182,box. Charles takes stickers. How many,12183,Nancy has saved cents from selling,12184,Larry collects pencils. Larry's father,12185,father gives Larry more. How many,12186,Each block costs How much do,12187,How much do blocks cost ?,12188, birds were sitting,12189,Then there were birds in the,12190,Tori was feet tall .,12191,Then she grew feet taller .,12192,marbles. He shares with Theresa. How,12193,marbles. He shares with Theresa. How,12194,basketball team is inches tall. This,12195,tall. This is inches taller than,12196,There are pencils in each,02197,pencils are in boxes ?,12198,Benny received dollars and 9,12199,". He had dollars over ,",12200,"apartment complex , the apartments are",12201,one-bedroom apartments and are two-bedroom apartments,12202,There are baskets. There are,12203,baskets. There are apples in each,12204,if you had bags of cookies,12205,of cookies with cookies in each,12206,How much would pieces of bubble,12207,each piece costs cents?,12208,Joyce has and Brian has,12209,and Brian has How much more,12210,There are students at a,12211,"each classroom holds students, how many",12212,Kenny used exactly of a cup,12213,of oil and cups of water.,12214,his roommates ate pints of ice,12215,Friday night and of a pint,12216,Sam has books. Joan has,12217,books. Joan has books. How many,12218,Amy starts with peanuts. Gerald gives,12219,Gerald gives Amy more. How many,12220,George has eggs. He shares,12221,eggs. He shares with Annie. How,12222,Joan's cat had kittens. She gave,12223,kittens. She gave to her friends.,12224,There are known nesting pairs,12225,today. This is more pairs than,12226,Brenda starts with eggs. num1 are,12227,with num3 eggs. are eaten by,12228,Tom. Melanie catches trout. Tom catches,12229,trout. Tom catches times as many,12230,Sarah has and Anna has,12231,and Anna has How much money,12232,. She used cup of flour,12233,of flour and cup of sugar,12234,Evelyn weighs pounds. Brian weighs,12235,pounds. Brian weighs pounds. How much,12236,David has boxes of Skittles.,12237,David has boxes of Skittles.,12238,that can contain wood carvings at,12239,a time. If wood carvings were,12240,store. She bought packs of cookies,12241,of cookies and packs of noodles.,12242,There are students in the,12243,the class and tickets. If the,12244,", Paul scored points . He",12245,a total of points . How,12246,There were bales of hay,12247,There are now bales of hay,12248,Virginia starts with eggs. Amy takes,12249,eggs. Amy takes away. How many,12250,"Pamela bought ounces of sugar,",12251,and she spilled ounces of it,12252,Alyssa picked pears and Nancy,12253,and Nancy picked pears from the,12254,Nicholas starts with marbles. He gets,12255,marbles. He gets more from Bonnie.,12256,Tammy drove miles in one,12257,she drive in hours?,12258,Louise has and Nicholas has,12259,and Nicholas has How much money,12260,Sandy grew pumpkins . Mike,12261,. Mike grew pumpkins . How,12262,dad brought home marble potatoes. If,12263,"can contain around pieces of wood,",12264,if they gathered pieces of wood?,12265,the result is Find the number.,12266,There were parents in the,12267,"the program and pupils, too. How",12268,cards. Jason gave to his friends.,12269,Jason now has Pokemon cards left.,12270,There are crayons in the,12271,drawer. Benny placed more crayons in,12272,Melissa has bananas. She shares,12273,bananas. She shares with Joshua. How,12274,yesterday. Ronald jumped times on the,12275,trampoline. Rupert jumped more times than,12276,a trumpet for and a song,12277,book which was How much did,12278,"Dan has violet marbles, he",12279,he gave Mary of the marbles.,12280,There are gallons of water,12281,"If Becky adds gallons more, how",12282,Joan has orange balloons but,12283,balloons but lost of them .,12284,She gathered up books to sell,12285,. She sold books in a,12286,Martin has and Barbara has,12287,and Barbara has How much money,12288,Catherine starts with tickets. She shares,12289,tickets. She shares with Antonio. How,12290,he gave Jessica of the seashells,12291,he gave Jessica of the seashells,12292,We ordered pizzas. Each pizza,12293,Each pizza has slices. How many,12294,blue ball weighed pounds and the,12295,brown ball weighed pounds . If,12296,Tammy gives to JeŒ´í‰í_rey. If,12297,Tammy started with how much money,12298,Jenny ran mile and walked,12299,mile and walked mile . How,12300,Lois has apples. She shares,12301,apples. She shares with Jason. How,12302,delivery route with tank of gas,12303,"the pizzeria , tank of gas",12304,"Sara grew pumpkins , but",12305,the rabbits ate pumpkins . How,12306,Betty has and Stephen has,12307,and Stephen has How much money,12308,some oranges for Irene has $num1,12309,"$num3, Irene has left. How much",12310,Josh had pencils. He gave,12311,pencils. He gave pencils to Dorothy.,12312,"trumpet for $ , and a",12313,which was $ . How much,12314,Mary had nickels in her,12315,dad gave her more nickels. How,12316,Alyssa picked limes and Mike,12317,and Mike picked limes . Tom,12318,There are Skittles in each,02319,Skittles are in boxes ?,12320,Anna starts with candies. She gets,12321,candies. She gets more from Larry.,12322,Nancy has black balloons. Mary,12323,balloons. Mary has times more black,12324,Jose starts with blocks. He finds,12325,He finds another How many blocks,12326,Iesha has books. num2 are,12327,has num3 books. are about school,12328,There are children in the,12329,student will get pencils. How many,12330,Mike picked oranges and Melanie,12331,and Melanie picked oranges . Fred,12332,line that was inches long. Then,12333,line that was inches long. How,12334,Bridget has Skittles. Henry has,12335,Bridget has Skittles. Henry has,12336,Lucy has fish. How many,12337,buy to have fish?,12338,cakes. She has children. She would,12339,cakes. She has children. She would,12340,Each child has bottle caps. If,12341,"If there are children, how many",12342,Bryan has skittles. Ben has,12343,skittles. Ben has M&MŒŠí_ŒÈs. How many,12344,There are flowers and num3,12345,num2 flowers and bees. How many,12346,Tom has yellow balloons Sara,12347,balloons Sara has yellow balloons .,12348,Ashley sold boxes of Samoas.,12349,Ashley sold boxes of Samoas.,12350,There are blocks in a,12351,box. Stephanie takes blocks. How many,12352,caps. She buys more. How many,12353,caps. She buys more. How many,12354,There are books in a,12355,shelves that hold books each. How,12356,There are dogwood trees currently,12357,workers will plant dogwood trees today,12358,Marlee has guests coming to,12359,table will hold guests. How many,12360,It rained inches on Saturday,12361,on Saturday and inches on Sunday,12362,"game for $ , and a",12363,game for $ . Tom already,12364,lunch . Only hamburgers were actually,12365,lunch . Only hamburgers were actually,12366,If she has origami papers to,12367,"away to her cousins, how many",12368,the rate of gallons per hour,12369,and it has gallons left in,12370,Elizabeth has and Eric has,12371,and Eric has How much more,12372,A truck carrying pounds of sand,12373,yard and loses pounds of sand,12374,Jack removes blocks from a,12375,There were originally blocks in the,12376,Mrs. Hilt has cents. A pencil,12377,A pencil costs cents. How many,12378,Nicholas collects tickets. Nicholas's father,12379,father gives Nicholas more. How many,12380,John collects blocks. John's father,12381,father gives John more. How many,12382,into groups of Eric has num2,12383,num3. Eric has peanuts. How many,12384,"Tom has violet balloons ,",12385,he gave Fred of the balloons,12386,Juan ran miles at num3,12387,num1 miles at miles per hour.,12388,"Ellen had legos, but Ellen",12389,but Ellen lost of them. How,12390,Sara has marbles. She loses,12391,marbles. She loses How many marbles,12392,Elizabeth is inviting friends to a,12393,Elizabeth is inviting friends to a,12394,Each child has oranges. If there,12395,"If there are children, how many",12396,If there are peanuts in a,12397,"and Earl puts more peanuts inside,",12398,She spent $ on a shirt,12399,shirt and $ on a jacket,12400,Katherine has bottle caps. num2,12401,num1 bottle caps. are eaten by,12402,Robert weighs pounds. Howard weighs,12403,pounds. Howard weighs pounds. How much,12404,Theresa has crayons. Janice has,12405,crayons. She shares with Nancy. How,12406,Norma wandered for hours at num3,12407,num1 hours at miles per hour.,12408,Cheryl has and Janet has,12409,and Janet has How much money,12410,Donald has oranges. He finds,12411,He finds another How many oranges,12412,to the store times last month.,12413,month. He buys bananas each time,12414,marbles. Carla bought marbles. Now Calra,12415,Now Calra has marbles all together.,12416,Janet has stickers. She gets,12417,Janet has stickers. She gets,12418,Douglas has bananas. He gives,12419,bananas. He gives to Marvin. How,12420,Joan found seashells on the,12421,she gave Mike of the seashells,12422,Evelyn has marbles. She gets,12423,marbles. She gets more from Henry.,12424,Bobby has books. Kristi has,12425,books. Kristi has books. How many,12426,into groups of Henry has num1,12427,num3. Henry has crayons. How many,12428, students are going,12429,group. There are teachers. How many,12430,A ounce can of,12431,juice sells for cents. Give the,12432,Robert gives to Lori. If,12433,Robert started with how much money,12434,Tim found seashells and 110,12435,. He gave of the seashells,12436,Tim has books. Mike has,12437,books. Mike has books. How many,12438,The recipe wants cups of flour.,12439,already put in cups. How many,12440,There are Skittles in a,12441,box. Debra takes Skittles. How many,12442,Gerald has and Anthony has,12443,and Anthony has How much money,12444,There are candies in a,12445,box. Stephanie takes candies. How many,12446,. He gave to his friends,12447,He now has Pokemon cards .,12448,Uncle Dave bought ice cream sandwiches.,12449,"them to his hungry nieces, how",12450,Dorothy has cards. She gives,12451,cards. She gives to Harold. How,12452,Each child has tickets. If there,12453,"If there are children, how many",12454,Phyllis starts with and spends $num1,12455,$num2 and spends on crayons. How,12456,Kim has cousins. She wants,12457,give each cousin pieces of gum.,12458,You have collected crickets. How many,12459,collect to have crickets?,12460,Jonah added cup of yellow,12461,yellow raisins and cup of black,12462,Each bag contains pounds of oranges.,12463,oranges are in bags?,12464,fruit salad with of a pound,12465,of melon and of a pound,12466,Carol collects peanuts. Carol's father,12467,father gives Carol more. How many,12468,a supply of bathing suits for,12469,", it has bathing suits for",12470,There are orchid bushes and,12471,workers will plant orchid bushes today,12472,A car traveled kilometers in num2,12473,num3 kilometers in hours. What was,12474,marbles. She bought marbles. Now she,12475,Now she has marbles. How many,12476,a box of crayons for his,12477,he only had left. How many,12478, of a number,12479,"a number is , what is",12480,Jose has peanuts. Kenya has,12481,peanuts. Kenya has more than Jose.,12482,to cut down oak trees that,12483,to cut down oak trees that,12484,There are oak trees currently,12485,to cut down oak trees that,12486,Mary found seashells and Keith,12487,and Keith found seashells on the,12488,high school played basketball games this,12489,were defeated during games . How,12490,"each glass needs lemons, how many",12491,if they have lemons?,12492,just transferred $ out of her,12493,now has $ in it .,02494,Megan had markers. Robert gave,12495,Robert gave her more markers. How,12496,There are erasers. num1 erasers,12497,are num3 erasers. erasers more are,12498,the rate of gallons per hour,12499,and it has gallons left in,12500,If she gathered cherry tomatoes and,12501,which can contain cherry tomatoes at,12502,There are oranges. num2 oranges,12503,are num1 oranges. oranges more are,12504,Carlos has blocks. He gives,12505,blocks. He gives to Rachel. How,12506,There are oak trees currently,12507,to cut down oak trees that,12508,Mike has books in his,12509,He now has books in his,12510,Alan collects candies. Alan's father,12511,father gives Alan more. How many,12512,Mrs. Sheridan has cats. How many,12513,need to have cats?,12514,a concert in buses. Each bus,12515,Each bus took students. How many,12516,James had stickers. He got,12517,Then he had stickers. How many,12518,There are candies in each,12519,candies are in boxes ?,12520,Lillian gives to Paul. If,12521,Lillian started with how much money,12522,There are erasers. num3 erasers,12523,are num2 erasers. erasers more are,12524,Sara picked pears and Tim,12525,and Tim picked pears from the,12526,Rose strolled for hours at num1,12527,num3 hours at miles per hour.,12528,There are candies. num1 candies,12529,are num2 candies. candies more are,12530,I have cents to buy,12531,"bulk candy costs cents, how many",12532,"Mike has orange marbles, he",12533,he gave Sam of the marbles.,12534,his roommates ate pints of ice,12535,Friday night and pint of ice,12536,Gloria has boxes of eggs.,12537,Each box holds eggs. How many,12538,There are candies. num2 candies,12539,are num1 candies. candies more are,12540,Larry has cards. Dennis takes,12541,cards. Dennis takes away. How many,12542,"fruits. Alyssa paid for grapes, and",12543,"for grapes, and for cherries. In",12544,David removes eggs from a,12545,There were originally eggs in the,12546, birds were sitting,12547,on the fence. more birds came,12548,Joan grew watermelons and 4,12549,. Tom grew watermelons . How,12550,a notebook for She paid with,12551,There are marbles in each,12552,marbles are in boxes?,12553,Each crayon costs How much do,12554,How much do crayons cost ?,12555,Each child has apples. If there,12556,"If there are children, how many",12557,A restaurant sold hamburgers last week.,12558,", she harvested pounds of honey",12559,honey harvest by pounds . How,12560,Jessica had quarters in her,12561,Her sister borrowed of her quarters.,12562,The sum of and a number,12563,a number is What is the,12564,cards to your best friends. You,12565,friends. You have baseball cards. How,12566,Jacqueline starts with and spends $num3,12567,$num2 and spends on crayons. How,12568,Antonio weighs pounds. Rebecca weighs,12569,pounds. Rebecca weighs pounds. How much,12570,Ralph has and George has,12571,and George has How much more,12572,IshaŒŠí_ŒÈs pencil is cubes long. If,12573,IshaŒŠí_ŒÈs pencil is cubes long. If,12574,a total of blood cells .,12575,first sample contained blood cells .,1