,phrase,sig_label698,the odometer read How many miles,1699,The sum of and a number,1700,a number is Find the number.,1701,There are fishbowls. Each fishbowl,1702,Each fishbowl has fish. How many,1703,Joe had toy cars. If,1704,"If he gets more cars, how",1705,Wendy ran miles and walked,1706,miles and walked miles. How much,1707,Clarence has oranges. He gets,1708,oranges. He gets more from Joyce.,1709,21 dimes and pennies in her,1710,Her dad borrowed pennies from Mary,1711,"on time. Unfortunately, passengers landed late.",1712,George has and Robert has,1713,and Robert has How much money,1714,I have cents to buy,1715,"each gumdrop costs cents, how many",1716,There are pencils in the,1717,drawer. Mike placed more pencils in,1718,so he harvests more bushels of,1719,some candies for Sean has $num3,1720,"$num1, Sean has left. How much",1721,Benjamin removes Skittles from a,1722,There were originally Skittles in the,1723,Emily starts with and spends $num2,1724,$num3 and spends on crayons. How,1725,Paul had strawberries in his,1726,basket. He picked more strawberries. How,1727,Betty bought pink flower stones,1728,wanted to make bracelets out of,1729,to read a page book for,1730,has already read pages. How many,1731,year he gains pounds. He is,1732,pounds. He is years old. How,1733,Ann has erasers. She buys,1734,erasers. She buys more. How many,1735,There are bananas. num2 bananas,1736,are num1 bananas. bananas more are,1737,are numnum2 cards. cards more are,1738,are numnum2 cards. cards more are,1739,each ticket costs dollars and they,1740,"and they bought tickets, how much",1741,Vegetarian Restaurant bought pounds of green,1742,Vegetarian Restaurant bought pounds of green,1743,Joan grew carrots and 14,1744,. Jessica grew carrots . How,1745,There were bales of hay,1746,There are now bales of hay,1747,Sara picked pears and Tim,1748,and Tim picked pears from the,1749,cards. He gave Pokemon cards to,1750,He now has Pokemon cards left.,1751,$numnum2 equally among total people. How,1752,$numnum2 equally among total people. How,1753,is played for months. How many,1754,is played for months. How many,1755,house. It is miles from Rachel's,1756,It took Rachel hours to get,1757,Lisa starts with bananas. Maria gives,1758,Maria gives Lisa more. How many,1759,The Hawks scored touchdowns worth num1,1760,num3 touchdowns worth points each. How,1761,to the store times last month.,1762,to the store times last month.,1763,Peter starts with erasers. Bridget gives,1764,Bridget gives Peter more. How many,1765,bank. She spent of her dimes.,1766,bank. She spent of her dimes.,1767,a total of hockey games a,1768,is played for months. How many,1769,Debra has boxes of oranges.,1770,Each box holds oranges. How many,1771,Angela has oranges. Marilyn takes,1772,oranges. Marilyn takes away. How many,1773,Donna weighs pounds. Willie weighs,1774,pounds. Willie weighs pounds. How much,1775, dogs are barking.,1776,dogs are barking. more dogs start,1777,"school, there are girls and num1",1778,num3 girls and boys. How many,1779,help him place seedlings in packets.,1780,"needs to contain seeds, how many",1781,Jazmin had dolls and Geraldine,1782,and Geraldine had dolls. If they,1783,been put into rows with num3,1784,num1 rows with chairs in each,1785,Laura weighs pounds. Beverly weighs,1786,pounds. Beverly weighs pounds. How much,1787,Kelly has Nintendo games. How,1788,she will have games left?,1789,Sally has blue balloons. Fred,1790,balloons. Fred has times more blue,1791,walk. You walk mile and then,1792,Then you walk of a mile.,1793,a pizza party. of a pizza,1794,"left over, and of another pizza",1795,There are pencils in the,1796,drawer. Tim placed more pencils in,1797,Donald has and Steven has,1798,and Steven has How much money,1799,Louis has candies. He finds,1800,He finds another How many candies,1801,Tom found seashells but num2,1802,num3 seashells but were broken .,1803,Alice has oranges. Christina takes,1804,oranges. Christina takes away. How many,1805,Anthony has and Carlos has,1806,and Carlos has How much more,1807,party. You buy pizzas. Each pizza,1808,Each pizza has slices. How many,1809,some cards for Debra has $num2,1810,"$num3, Debra has left. How much",1811,Mark sprinted miles at num3,1812,num1 miles at miles per hour.,1813,Julie starts with and spends $num1,1814,$num3 and spends on bottle caps.,1815,from all the continents that Bryan,1816,"and he collected books per continent,",1817,from all the continents that Bryan,1818,Nicholas starts with and spends $num2,1819,$num1 and spends on blocks. How,1820,on the fence. more owls joined,1821,on the fence. more owls joined,1822,Sally saw dozen birds in,1823,If of eight pets,1824,Jason grew watermelons and 18,1825,. Nancy grew watermelons . How,1826,Sally picked lemons and Mary,1827,and Mary picked lemons from the,1828,George starts with crayons. He buys,1829,crayons. He buys more. How many,1830,There are crayons in each,1831,crayons are in boxes?,1832,Jerry has and Patrick has,1833,and Patrick has How much money,1834,Each egg costs How much do,1835,How much do eggs cost ?,1836,Each child has eggs. If there,1837,"If there are children, how many",1838,clown blew up balloons. Then he,1839,he blew up more balloons. How,1840,There were book shelves. Each,1841,book shelf had books. How many,1842,Lillian has and Janet has,1843,and Janet has How much money,1844,There are cupcakes for num1,1845,num3 cupcakes for children to share.,1846,Ann has oranges. She buys,1847,oranges. She buys more. How many,1848,A ounce can of,1849,juice sells for cents. Give the,1850,"first watermelon was pounds, and the",1851,second watermelon was pounds. How many,1852,Aaron starts with erasers. He gives,1853,erasers. He gives to Doris. How,1854,Patrick has cards. He gets,1855,cards. He gets more from Irene.,1856,There are rulers in the,1857,drawer. Tim took rulers from the,1858,Carlos starts with bananas. num3 are,1859,with num2 bananas. are eaten by,1860,Charlie has more snowballs than,1861,Lucy. She has snowballs. How many,1862,Jason's shelves hold books each. How,1863,if Jason has books?,1864,is filled with tons of cargo,1865,where sailors load tons of cargo,1866,There are candies in a,1867,bag. Diana takes candies out of,1868,There are books in Oak,1869,", there are books in its",1870,that they fill drums of grapes,1871,be filled in days?,1872,There were roses in the,1873,There are now roses in the,1874,We ordered pizzas. Each pizza,1875,Each pizza has slices. How many,1876,Gregory starts with and spends $num2,1877,$num3 and spends on stickers. How,1878,high school played baseball games this,1879,. She attended games . How,1880,some stickers for Lawrence has $num2,1881,"$num1, Lawrence has left. How much",1882,"Ellen had Legos, but she",1883,but she lost Legos. How many,1884,of Milburg has grown-ups and num1,1885,num2 grown-ups and children. How many,1886,Mary collects Skittles. Mary's father,1887,father gives Mary more. How many,1888,Nancy starts with bottle caps. She,1889,She finds another How many bottle,1890,If there are erasers in a,1891,"and Daniel puts more erasers inside,",1892,Fred has baseball cards .,1893,. Keith bought of Fred 's,1894,Sam had pennies in his,1895,. He spent of his pennies,1896,CindyŒŠí_ŒÈs mom baked cookies. PaulŒŠí_ŒÈs dad,1897,PaulŒŠí_ŒÈs dad baked cookies. They both,1898,James has balloons. Amy has,1899,balloons. Amy has balloons. How many,1900,"In HaleyŒŠí_ŒÈs class, are boys who",1901,"If Haley has marbles, how many",1902,The rabbits ate of the potatoes.,1903,The rabbits ate of the potatoes.,1904,Anne starts with and spends $num3,1905,$num1 and spends on stickers. How,1906,and Jason have crayons all together.,1907,green caterpillar was inches long and,1908,orange caterpillar was inches long .,1909,high school played basketball games this,1910,were defeated during games. How many,1911,"the rides are dollars each ,",1912,an armband for dollars and ride,1913,Gerald collects eggs. Gerald's father,1914,father gives Gerald more. How many,1915,Iesha has books. num3 are,1916,has num1 books. are about school,1917,Keith bought eggs from the,1918,JaneŒŠí_ŒÈs mom prepared pieces of bite-size,1919,swirls. If the of them ate,1920,treats for her dogs. If she,1921,"to buy them heart biscuits each,",1922,Frances has boxes of eggs.,1923,Each box holds eggs. How many,1924,Sara has red and 15,1925,. Sandy has red balloons .,1926, children were riding,1927,Then there were children altogether on,1928,he will harvest bushels of wheat,1929,so he harvests bushels of wheat,1930,A chef bought kilograms of almonds,1931,of almonds and kilograms of pecans,1932,Mary had nickels in her,1933,dad gave her nickels . How,1934,already put in cups. How many,1935,already put in cups. How many,1936,Fred found seashells on the,1937,he gave Jessica of the seashells.,1938,There are calories in a,1939,are there in candy bars ?,1940,Barbara starts with cards. She gives,1941,cards. She gives to Rebecca. How,1942,Mrs. Hilt saw bees in the,1943,day she saw times that many.,1944,The sum of and a number,1945,a number is ,1946,Rachel starts with bananas. Katherine takes,1947,bananas. Katherine takes away. How many,1948,Isabel bought pieces of paper.,1949,paper. She used pieces of the,1950,Nicholas starts with bottle caps. He,1951,caps. He gets more from Catherine.,0952,Sara saw birds in a,1953,an apple for and pays with,1954,pays with a bill. How much,0955,Mrs. Hilt bought pizzas for $num1,1956,num3 pizzas for each. What was,1957,numnum3 bugs eat flowers each. How,1958,numnum3 bugs eat flowers each. How,1959,Each child has pencils. If there,1960,"If there are children, how many",1961,Eve ran of a mile,1962,mile and walked of a mile.,1963,Jonah added of a cup,1964,yellow raisins and of a cup,1965,Ernest has with tickets. Ernest finds,1966,Ernest finds another How many tickets,1967,supply store has bags of dog,1968,dog food and bags of cat,1969,"a collection of classic authors, with",1970,"each author having books, how many",1971,If there are erasers in a,1972,"and Patrick puts more erasers inside,",1973,Clarence has tickets. He gives,1974,tickets. He gives to Eugene. How,1975,Billy has crayons. num2 are,1976,has num1 crayons. are eaten by,1977,bananas. She gets more from Joyce.,1978,bananas. She gets more from Joyce.,1979,I walked miles in 1,1980,"pace for the hours I walk,",1981,Janet removes peanuts from a,1982,There were originally peanuts in the,1983,Misha has dollars. How many,1984,earn to have dollars?,1985,Jason had quarters in his,1986,dad gave him quarters . How,1987,Jason has Pokemon cards. Alyssa,1988,cards. Alyssa bought of Jason's Pokemon,1989,his friends drank bottles of lemon-lime,1990,his friends drank bottles of lemon-lime,1991,some bananas for Jonathan has $num1,1992,"$num3, Jonathan has left. How much",1993,Arthur baked muffins. How many,1994,bake to have muffins?,1995,There are bottle caps in,1996,caps are in boxes?,1997,"1 cm represents kilometers , how",1998,are represented by cm?,1999,Jennifer removes Skittles from a,11000,There were originally Skittles in the,11001,Sara had quarters in her,11002,dad gave her quarters . How,11003,carrots. Sam grew carrots. How many,11004,carrots. Sam grew carrots. How many,11005,"is fixed , tons of grain",11006,water . Only tons of grain,11007,JeŒ´í‰í_rey has boxes of apples.,11008,Each box holds apples. How many,11009,wanted to have bracelets with star-shaped,11010,She also bought star-shaped stones from,11011,Andrew spent day working on,11012,He worked for hours each day.,11013, beavers were working,11014,on their home. went for a,11015,Marilyn has bananas that must,11016,"If there are boxes, how many",11017,Sean starts with apples. He finds,11018,He finds another How many apples,11019,high school played baseball games this,11020,year. He attended games. How many,11021,Roy has and Sean has,11022,and Sean has How much money,11023,Nancy bought crayons that came,11024,in packs of How many packs,11025,Eve ran mile and walked,11026,mile and walked mile . How,11027,If there are peanuts in a,11028,"and Deborah puts more peanuts inside,",11029,There are gallons of water,11030,"If Becky adds gallons more ,",11031,construction company bought tons of gravel,11032,of gravel and tons of sand,11033,house. It is miles from Emily's,11034,It took Emily hours to get,11035,Sam found seashells on the,11036,he gave Joan of the seashells,11037,Norma starts with bananas. She loses,11038,bananas. She loses How many bananas,11039,Arthur baked muffins. James baked,11040,muffins. James baked times as many.,11041,Martha starts with marbles. She buys,11042,marbles. She buys more. How many,11043,. She used tablespoon of cinnamon,11044,of cinnamon and tablespoon of nutmeg,11045,My car gets miles per gallon,11046,I drive on gallons of gas?,11047,George has boxes of blocks.,11048,Each box holds blocks and there,11049,his friends drank bottles of lemon-lime,11050,his friends drank bottles of lemon-lime,11051,Deborah has and Anthony has,11052,and Anthony has How much more,11053,Mrs. Hilt uses ounces of detergent,11054,use to wash pounds of clothes?,11055,There are students in the,11056,the class and tickets. If the,11057,a concert in buses. Each bus,11058,Each bus took students. How many,11059,basketball game for and a racing,11060,racing game for How much did,11061,Haley has magazines in her,11062,"which can contain magazines, how many",11063,Fred has baseball cards. Melanie,11064,cards. Melanie bought of Fred's baseball,11065,A bucket contains gallons of water.,11066,"If Derek adds gallons more, how",11067,minutes. I walked miles. How many,11068,minutes. I walked miles. How many,11069,of pants is dollars. If the,11070,the store paid dollars less for,11071,Donald has and Sharon has,11072,and Sharon has How much money,11073,There are students making num1,11074,num2 students making stars each for,11075,put them into baskets. She put,11076,baskets. She put eggs into each,11077,Christine wandered miles at num2,11078,num3 miles at miles per hour.,11079,Brenda has apples. She gets,11080,apples. She gets more from Willie.,11081,"is made with different colored feathers,",11082,are needed for crowns?,11083,yellow block weighed pounds and the,11084,green block weighed pounds. How much,11085,"rode the bus miles, and then",11086,and then walked of a mile,11087,If there are stickers in a,11088,"and Betty puts more stickers inside,",11089,Lisa rented DVDs for $num20.,11090,num3 DVDs for How much did,01091,The recipe wants cups of flour,11092,already put in cups . How,11093,Tom found seashells but num3,11094,num1 seashells but were broken. How,11095,There are scissors in the,11096,drawer. Keith placed more scissors in,11097,A chef bought kilograms of almonds,11098,of almonds and kilograms of pecans.,11099,There were roses in the,11100,There are now roses in the,11101,Sandy worked hours in the,11102,in the last days. Assuming that,11103,Sam had dimes in his,11104,dad gave him more dimes. How,11105,"Sally had baseball cards ,",11106,. Sara bought of Sally 's,11107,Beka flew miles to visit,11108,aunt. Jackson flew miles to visit,11109,Benny picked apples and Dan,11110,and Dan picked apples from the,11111,You have cookies and want,11112,them equally with people. How many,11113,Tom has yellow balloons. Sara,11114,balloons. Sara has yellow balloons. How,11115,Each child has candies. If there,11116,"If there are children, how many",11117,Frances removes erasers from a,11118,There were originally erasers in the,11119,Jason has Pokemon cards .,11120,. Alyssa bought of Jason 's,11121,Frank worked hours on the,11122,on the first days of the,11123,to school is of a mile,11124,bus ride is of a mile.,11125,Nancy grew potatoes . Sandy,11126,. Sandy grew potatoes . How,11127,Terry has and Lawrence has,11128,and Lawrence has How much money,11129,she practiced driving of a mile,11130,mother and another of a mile,11131,March it rained inches. It rained,11132,inches. It rained inches less in,11133,Fred has cents in his,11134,into groups of Jeffrey has num3,11135,num2. Jeffrey has bottle caps. How,11136,Each sticker costs How much do,11137,How much do stickers cost ?,11138,1 worm was inch long .,11139,other worm was inch long .,11140,Sam has books . Joan,11141,. Joan has books . How,11142,March it rained inches . It,11143,. It rained inches less in,11144,There were students riding on,11145,"the first stop, students got off",11146,candy store has boxes of chocolates.,11147,Each box has pieces. How many,11148,There are people on the,11149,"relay race is meters long, how",11150,Heather starts with blocks. She shares,11151,blocks. She shares with Jose. How,11152,Montoya family spends their budget on,11153,groceries and another going out to,11154,There are crayons in the,11155,. Benny placed crayons in the,11156,Elisa has dollars. How many,11157,earn to have dollars?,11158,Aaron starts with and spends $num2,11159,$num3 and spends on stickers. How,11160,Janice weighs pounds. Jonathan weighs,11161,pounds. Jonathan weighs pounds. How much,11162,is divided by to get num1?,11163,num3 to get ,11164,Sam went to football games this,11165,He went to games last year.,11166,If Bryan has books in each,11167,"each of his bookshelves, how many",11168,There are pencils and 49,11169,. Dan took pencils from the,11170,A restaurant served pizzas during lunch,11171,during lunch and during dinner today.,11172,some peanuts for Henry has $num1,11173,some peanuts for Henry has $num1,11174,Jorge scored goals playing soccer,11175,season he scored goals. What is,11176,Jill invited people to her,11177,They each ate pieces of pizza.,11178,Tim has books . Mike,11179,. Mike has books . How,11180,to the store times last month.,11181,month. He buys tickets each time,11182,Kevin starts with cards. He finds,11183,Kevin starts with cards. He finds,11184,"hardware store , the nails are",11185,size 2d and the nails are,11186,. He gave to his friends,11187,He now has puppies . How,11188,garden. She needs rocks to complete,11189,border. She has rocks. How many,11190,. There are ladybugs with spots,11191,with spots and ladybugs without spots,11192,It takes minutes to bake,11193,take to bake pans of cookies?,11194,Benny found seashells and 49,11195,. He gave of the seashells,11196,Dan spent $ on a snake,11197,cost him $ . Dan also,11198,Randy has blocks. He uses,11199,blocks. He uses blocks to build,11200,Bridget has pencils. She loses,11201,pencils. She loses How many pencils,11202,George has boxes of eggs.,11203,Each box holds eggs and there,11204,a total of football games this,11205,"this year , are played at",11206,"this year , are played at",11207,in packages of If Mom buys,11208,"If Mom buys packages, how many",11209,bracelets. She brought heart-shaped stones and,11210,wanted to have of this type,11211,Bridget has Skittles. Henry has,11212,Bridget has Skittles. Henry has,11213,Warren has guests coming to,11214,table will hold guests. How many,11215,Joan has books . Tom,11216,. Tom has books . How,11217,perfect score is points. How many,11218,you have after perfect games in,11219,Barbara has candies. She buys,11220,candies. She buys more. How many,11221,Tim has saved cents from selling,11222,Margaret gives to Steve. If,11223,Margaret started with how much money,11224,", which is of what its",11225,some apples for Willie has $num3,11226,"$num1, Willie has left. How much",11227,Patrick has cards. He gets,11228,cards. He gets more from Irene.,11229,Sam found seashells on the,11230,he gave Joan of the seashells.,11231,a bucket with gallon of water,11232,she realized only gallon of water,11233,"If Karen sold boxes of Tagalongs,",11234,many cases of boxes does Karen,11235,There are crayons in the,11236,. Mary took crayons out of,11237,Each card costs How much do,11238,How much do cards cost ?,11239,If Joan bicycled miles at num3,11240,"num2 miles at miles per hour,",11241,Jenny ran of a mile,11242,mile and walked of a mile.,11243,Melissa scored points in each,11244,she score in games?,11245,Debra has and Rebecca has,11246,and Rebecca has How much money,11247,"game for $ , and a",11248,game for $ . How much,11249,Phyllis has and Ruth has,11250,and Ruth has How much money,11251,Christopher strolled miles at num1,11252,num3 miles at miles per hour.,11253,There are students at a,11254,"each classroom holds students, how many",11255,There were red orchids and,11256,There are now red orchids in,11257,Martha is inviting friends to a,11258,party. She has cookies. How many,11259,Each orange costs How much do,11260,How much do oranges cost ?,11261,Each child has eggs. If there,11262,"If there are children, how many",11263,Mark sprinted miles at num2,11264,num1 miles at miles per hour.,11265,There are pencils and 7,11266,. Benny placed pencils in the,11267,Mike picked pears and Jason,11268,and Jason picked pears from the,11269,Stephen has bottle caps. He,11270,He finds another How many bottle,11271,There are cards in a,11272,box. Douglas takes cards. How many,11273,BobŒŠí_ŒÈs car gets kilometers per gallon.,11274,BobŒŠí_ŒÈs car gets kilometers per gallon.,11275,Karen added of a cup,11276,Karen added of a cup,11277,"Mary had Pokemon cards ,",11278,Sam gave Mary new Pokemon cards,11279,Connie has red markers and,11280,red markers and blue markers. How,11281,Tina starts with stickers. She loses,11282,stickers. She loses How many stickers,11283,some marbles for Cynthia has $num3,11284,"$num2, Cynthia has left. How much",11285,Sally had quarters in her,11286,. She spent of her quarters,11287,Timothy starts with and spends $num3,11288,$num1 and spends on stickers. How,11289,Paul had strawberries in his,11290,basket. He picked more strawberries. How,11291,fiction section has books. If each,11292,fiction section has books. If each,11293,Eugene has pencils. He gets,11294,pencils. He gets more from Joyce.,11295,"mathematics class , the students received",11296,A 's and received B 's,11297,"first pumpkin weighed pounds, and the",11298,second pumpkin weighed pounds. How much,11299,Dan has green and 38,11300,. Mike took of Dan 's,11301,William has bottle caps. He,11302,caps. He buys more. How many,11303,There are pencils and num1,11304,num3 pencils and rulers in the,11305,num3 pencils and rulers in the,11306,Each egg costs How much do,11307,How much do eggs cost ?,11308,Each banana costs How much do,01309,How much do bananas cost?,11310,Brenda has eggs. She buys,11311,eggs. She buys more. How many,11312,a tree with nuts. How many,11313,a tree with nuts. How many,11314,Kathy weighs pounds. Randy weighs,11315,pounds. Randy weighs pounds. How much,11316,Brandon has Skittles. Bonnie has,11317,Skittles. He loses How many Skittles,11318,There are candies in a,11319,box. Antonio takes candies. How many,11320,Ronald has boxes of blocks.,11321,Each box holds blocks. How many,11322,Louise has oranges stored in,11323,"If there are boxes, how many",11324,Anthony has pencils. Kathryn gives,11325,Kathryn gives Anthony more. How many,11326,zoo. They sit children in every,11327,zoo. They sit children in every,11328,There are dogwood trees currently,11329,workers will plant more dogwood trees,11330,"football for $ , and spent",11331,and spent $ on marbles .,11332,If there are crayons in a,11333,"and Gerald puts more crayons inside,",11334,"the pipe , liters of oil",11335,the pipe leaked liters of oil,11336,fruit salad with pound of melon,11337,of melon and pound of berries,11338,There are erasers in a,11339,bag. Doris takes erasers out of,11340,"gross pay is dollars , while",11341,"net pay is dollars , how",11342,Dan has He bought a,01343,candy bar for How much money,01344,Jeremy strolled kilometers at num3,11345,num1 kilometers at kilometers per hour.,11346,Anne wandered for hours at num3,11347,num1 hours at miles per hour.,11348,Martha starts with cards. She gets,11349,cards. She gets more from Emily.,11350,Mr. Guzman bought doughnuts packed equally,11351,packed equally into boxes. How many,11352,Donna removes candies from a,11353,There were originally candies in the,11354,Richard starts with oranges. num3 are,11355,with num2 oranges. are eaten by,11356,Fred has baseball cards .,11357,. Melanie bought of Fred 's,11358,David gives to Anthony. If,11359,David started with how much money,11360,Sara has dozen golf balls.,11361,Sharon removes marbles from a,11362,There were originally marbles in the,11363, of Joe 's,11364,If she pays dollars in taxes,11365,Robert starts with erasers. He loses,11366,erasers. He loses How many erasers,11367,Mr. Guzman bought doughnuts packed equally,11368,packed equally into boxes. How many,11369,SueŒŠí_ŒÈs mother made cookies. She put,11370,"in bags, with cookies in each",11371,Each child has apples. If there,11372,"If there are children, how many",11373,The sum of and a number,11374,a number is Find the number.,11375,recipe calls for cups of sugar.,11376,recipe calls for cups of sugar.,11377,Raymond has boxes of Skittles.,11378,Each box holds Skittles. How many,11379,Jesse has bananas. If he,11380,"shares them among friends, how many",11381,Each child has stickers. If there,11382,"If there are children, how many",11383,There are cards. num1 cards,11384,are num3 cards. cards more are,11385,house. It is miles from Martin's,11386,It took Martin hours to get,1