,phrase,sig_label0,a total of soccer games during,11,games during the month season. If,12,Jill invited people to her,13,They each ate pieces of pizza.,14,Tim found seashells and Sally,15,and Sally found seashells on the,16,to the store times last month.,17,month. She buys peanuts each time,18,Wanda has blocks. Theresa gives,19,Theresa gives Wanda more. How many,110,line that was inches long .,111,line that was inches long .,112,Sarah sold boxes of Lemon,113,"many cases of boxes, plus extra",114,Joshua has Skittles and 6,115,"the Skittles among friends, how many",116,Willie weighs pounds. Kevin weighs,117,pounds. Kevin weighs pounds. How much,118,Each ticket costs How much do,119,How much do tickets cost?,120,If Teresa jogged kilometers at num2,121,"num1 kilometers at kilometers per hour,",122,There are birds on the,123,on the fence. more birds land,124,Jack is inviting friends to a,125,Jack is inviting friends to a,126,high school played hockey games this,127,year. She attended games. How many,128,to the store times last month.,129,month. She buys oranges each time,130,old lamp was foot tall and,131,new lamp is feet tall. How,132,Bryan had precious stones in,133,"were sold at dollar each, how",034,Jason has blue and 16,135,. Tom has blue marbles .,136,David has bananas. He gets,137,bananas. He gets more from Christopher.,138,Joan picked oranges and Sara,139,and Sara picked oranges . Alyssa,140,Brian removes bananas from a,141,There were originally bananas in the,142,Gino has popsicle sticks. I,143,sticks. I have popsicle sticks. What,144,Peter has crayons. Joyce takes,145,crayons. Joyce takes away. How many,146,Paula gives to Eric. If,147,Paula started with how much money,148,and she got get well cards,149,home she got more cards from,150,Shiela has neighbors who like,151,drawings. Shiela drew animals on small,152,Brian has bottle caps. Mildred,153,caps. Mildred has bottle caps. If,154,Harry starts with apples. He buys,155,apples. He buys more. How many,156,There are bananas in Diane's,157,"are organized into groups, how big",158,Brennan had grams of pepper.,159,Then he used grams of the,160,noodles. He gave noodles to William.,161,Daniel only has noodles. How many,162,Each child has tickets. If there,163,"If there are children, how many",164,house. It is miles from Emily's,165,It took Emily hours to get,166,fault line moved inches during the,167,past year and inches the year,168,that they harvest sacks per day.,169,they have after days of harvest?,170,There are erasers. num1 erasers,171,are num2 erasers. erasers more are,172,Fred has blue marbles. Fred,173,marbles. Fred has times more blue,174,Jonathan collects pencils. Jonathan's father,175,father gives Jonathan more. How many,176,Joan has orange balloons but,177,balloons but lost of them. How,178,Ben gave him more fish. Now,179,Now he has How many fish,180,Sally grew carrots . Fred,181,. Fred grew carrots . How,182,'s cat had kittens . She,183,. She gave to her friends,184,Kelly had apples. How many,185,pick to have apples altogether?,186,Mrs. Hilt bought hot dogs. Each,187,hot dog cost cents. How much,188,Anne weighs pounds. Douglas weighs,189,pounds. Douglas weighs pounds. How much,190,Anthony starts with and spends $num2,191,$num3 and spends on apples. How,192,Joan picked apples from the,193,", and gave apples to Melanie",194,There are stickers on a,195,"If you have pages of stickers,",196,a stack of sheets of used,197,27 pennies and dimes in his,198,dad gave him dimes and 49,199,If Teresa jogged kilometers at num3,1100,"num1 kilometers at kilometers per hour,",1101,Patricia starts with candies. Albert takes,1102,candies. Albert takes away. How many,1103,His story has frames in all.,1104,to put exactly frames on each,1105,some peanuts for Stephen has $num3,1106,"$num1, Stephen has left. How much",1107,"Fred has green balloons, he",1108,he gave Sandy of the balloons.,1109,week Tom had dollars . He,1110,and now has dollars . How,1111,There are stickers in each,1112,stickers are in boxes ?,1113,snow fall was The total attendance,1114,that day was How many students,1115,Robert removes pencils from a,1116,There were originally pencils in the,1117,shop. He bought gold fish and,1118,gold fish and blue fish. How,1119,Richmond's zoo eats of a bucket,1120,of trout and of a bucket,1121,Steve has oranges. He shares,1122,oranges. He shares with Patrick. How,1123,If there are pencils in a,1124,"and Denise puts more pencils inside,",1125,Patrol picked up glass bottles and,1126,glass bottles and aluminum cans on,1127,Robin has packages of gum.,1128,gum. There are pieces in each,1129,IsabellaŒŠí_ŒÈs hair is cubes long. If,1130,"her hair grows more inches, how",1131,Joan has blue balloons Melanie,1132,balloons Melanie has blue balloons. How,1133,fountain. It was feet. How many,1134,the water fountain times today?,1135,the car at mph. They camped,1136,after traveling for hours. How far,1137,It took Katherine hours to run,1138,Louis's house at miles per hour.,1139,Paradise Park has seats. Each seat,1140,seat can hold people. How many,1141,Shirley sold boxes of Do-Si-Dos.,1142,"many cases of boxes, plus extra",1143,There are crayons and 26,1144,. Sam placed crayons in the,1145,some tickets for Phillip has $num2,1146,"$num1, Phillip has left. How much",1147,cards. Diana has cards. If Diana,1148,cards. Diana has cards. If Diana,1149,Emily collects cards. Emily's father,1150,father gives Emily more. Bruce has,1151,Each child has stickers. If there,1152,"If there are children, how many",1153,a bucket with gallon of water,1154,he poured out gallon of the,1155,Mary starts with eggs. She finds,1156,She finds another How many eggs,1157,day she saw times that many.,1158,day she saw times that many.,1159,There are apples in a,1160,package of 11. apples are added,1161,Tom found seashells and Fred,1162,and Fred found seashells on the,1163,Jenny sold boxes of Trefoils.,1164,"many cases of boxes, plus extra",1165,Raymond has and James has,1166,and James has How much money,1167,"bee colony produced pounds of honey,",1168,but bears ate pounds of it.,1169,Marie starts with and spends $num2,1170,$num3 and spends on cards. How,1171,"Mike has muffins, which he",1172,"numnum1 miles at miles per hour,",1173,"numnum1 miles at miles per hour,",1174,There are cards in a,1175,box. Judith takes cards. How many,1176,Brad has balloons. num3 balloons,1177,has num2 balloons. balloons are red,1178,selling hamburger for dollars per pound.,1179,pound. This is dollars less than,1180,Heather has oranges. Russell takes,1181,oranges. Russell takes away. How many,1182,If there are crayons in a,1183,"and Roger puts more crayons inside,",0184,Mitch's family drank of a carton,1185,regular milk and of a carton,1186,"Sara grew pumpkins, but the",1187,the rabbits ate pumpkins. How many,1188,dish originally contained bacteria . A,1189,now there are of them .,1190,There are students in the,1191,the class and eggs. If the,1192,There are walnut trees currently,1193,workers will plant walnut trees today,1194,Lucy has fish. How many,1195,buy to have fish?,1196,a total of inches of the,1197,", they repaved inches of the",1198,There are marbles. num2 marbles,1199,are num1 marbles. marbles more are,1200,James ate carrot sticks before,1201,before dinner and more after dinner.,1202,some eggs for Stephen has $num3,1203,"$num1, Stephen has left. How much",1204,his height is inches. At his,1205,the child was inches tall. How,1206,Paula has boxes of peanuts.,1207,Each box holds peanuts. How many,1208,There were red orchids and,1209,There are now red orchids in,1210,Anna has and Marvin has,1211,and Marvin has How much more,1212,Ashley sold boxes of Samoas.,1213,Ashley sold boxes of Samoas.,1214,Dan had potatoes and num1,1215,num3 potatoes and cantelopes in the,1216,num3 potatoes and cantelopes in the,1217,Fred had dimes in his,1218,His sister borrowed of his dimes.,1219,to school is of a mile,1220,bus ride is of a mile.,1221,I read pages of my,1222,"Today, I read pages. What is",1223,person orders the lunch special. Benny,1224,Melanie is selling gumballs for eight,1225,Each child has cards. If there,1226,"If there are children, how many",1227,"On Friday, people visited the",1228,visited the zoo. times as many,1229,marbles. She bought marbles. Now she,1230,Now she has marbles all together.,1231,Rachel removes bottle caps from,1232,There were originally bottle caps in,1233,There are tickets in a,1234,box. Patrick takes tickets. How many,1235,", which is of what its",1236,A restaurant sold pies every day,1237,There are maple trees currently,1238,there will be maple trees in,1239,There are fishbowls. Each fishbowl,1240,Each fishbowl has fish. How many,1241,Evelyn has boxes of marbles.,1242,Each box holds marbles. How many,0243,Karen added cup of walnuts,1244,Karen added cup of walnuts,1245,There are students in the,1246,There are students in the,1247, the students in,1248,trumpet section . the students in,1249,If Benjamin skated kilometers at num2,1250,"num3 kilometers at kilometers per hour,",1251,There are boys and some,1252,playground. There are children altogether. How,1253,Larry starts with stickers. He loses,1254,stickers. He loses How many stickers,1255,Each child has peanuts. If there,1256,"If there are children, how many",1257,of iron weighed pounds and the,1258,of aluminum weighed pound . How,1259,John weighs pounds. Roy weighs,1260,pounds. Roy weighs pounds. How much,1261,Keith picked pears and Jason,1262,and Jason picked pears from the,1263,his height is inches. At his,1264,the child was inches tall. How,1265,Eric has erasers. If he,1266,"shares them among friends, how many",1267,Mrs. Sheridan has cats. Mrs. Garrett,1268,Mrs. Garrett has cats. How many,1269,Willie starts with stickers. He gives,1270,stickers. He gives to Emily. How,1271,Daniel has Skittles. Paula gives,1272,Paula gives Daniel more. How many,1273,A teacher has pieces of candy.,1274,"If there are students, and the",1275,the names from pages of the,1276,listed on another pages of the,1277,Dan bought dozen eggs from,1278,There are pencils in a,1279,box. Clarence takes pencils. How many,1280,There are marbles. num2 marbles,1281,are num1 marbles. marbles more are,1282,There are marbles in each,1283,marbles are in boxes?,1284,Michael has blocks stored in,1285,"If there are boxes, how many",1286,cereal box holds cups of cereal.,1287,Each serving is cups. How many,1288,There are pencils in a,1289,box. Eric takes pencils. How many,1290,into groups of Steven has num1,1291,num3. Steven has cards. How many,1292,Each chair cost dollars. How much,1293,spend for the chairs she bought?,1294,There are orchid bushes currently,1295,workers will plant orchid bushes today,1296,My car gets miles per gallon,1297,"GrandmaŒŠí_ŒÈs house is miles away, how",1298,"After a party, of the cake",1299,big brother eats of the cake.,1300,Julia gives to Nicholas. If,1301,Julia started with how much money,1302,mom gave him more balloons for,1303,"Then, Tommy had balloons. How many",1304,Mark has trees in his,1305,"If he plants more, how many",1306,Rebecca removes cards from a,1307,There were originally cards in the,1308,a total of gems . num1,1309,num3 gems . of the gems,1310,MaryŒŠí_ŒÈs car gets miles per gallon,1311,she drive on gallons of gas?,1312,to the store times last month.,1313,month. He buys oranges each time,1314,Donna starts with apples. She gives,1315,apples. She gives to Judith. How,1316,Dan picked limes and gave,1317,and gave Sara of the limes.,1318,Mary picked oranges and Jason,1319,and Jason picked oranges . Keith,1320,Erik got through pie before time,1321,Frank finished just pie . How,1322,Ashley sold boxes of Samoas.,1323,Ashley sold boxes of Samoas.,1324,Dan has violet balloons. Tim,1325,balloons. Tim has times more violet,1326,Tina has crayons. Thomas has,1327,crayons. Thomas has crayons. If Thomas,1328,There are erasers in each,0329,erasers are in boxes ?,1330,some crayons for Mark has $num2,1331,"$num3, Mark has left. How much",1332,There is cup of oil,1333,"If Scarlett adds cup more ,",1334,Sara had quarters and num2,1335,num1 quarters and dimes in her,1336,Sara had quarters and num2,1337,Vegetarian Restaurant bought pound of green,1338,Vegetarian Restaurant bought pound of green,1339,There were roses in the,1340,There are now roses in the,1341,Connie has red markers and,1342,red markers and blue markers. How,1343,Harold has and Phillip has,1344,and Phillip has How much money,1345,Mary picked oranges and Jason,1346,and Jason picked oranges from the,1347,Christina has boxes of tickets.,1348,Each box holds tickets. How many,1349,Darius drove miles to visit,1350,grandmother. Julia drove miles to visit,1351,There are scissors and 22,1352,. Dan placed scissors in the,1353,Judy has cards. Henry takes,1354,cards. Henry takes away. How many,1355,After paying dollars for the,1356,", Mary has dollars , her",1357,Joan found seashells and 14,1358,. She has seashell . How,1359,Sandy grew carrots and 7,1360,. Mary grew carrots . How,1361,Ruth starts with apples. She shares,1362,apples. She shares with Peter. How,1363,Earl has and Carlos has,1364,and Carlos has How much more,1365,Lisa flew miles at num3,1366,num1 miles at miles per hour.,1367,There are known nesting pairs,1368,today. This is more pairs than,1369,There are bananas in a,1370,box. Bridget takes bananas. How many,1371,It took me minutes to walk,1372,minutes to walk meters. How fast,1373,the result is Find the number.,1374,There are bottle caps. num2,1375,num3 bottle caps. bottle caps more,1376,a total of football games in,1377,is played for months. How many,1378,There are cupcakes for num3,1379,num1 cupcakes for children to share.,1380,Joan had dimes in her,1381,. She spent of her dimes,1382,Michael collects peanuts. Michael's father,1383,father gives Michael more. How many,1384,Molly had candles on her,1385,older and got more on her,1386,Marie starts with erasers. She loses,1387,erasers. She loses How many erasers,1388,Tom found seashells on the,1389,he gave Jessica of the seashells.,1390,marbles. She gave to Juan. Now,1391,Now she has marbles left. How,1392,Melanie grew turnips . Benny,1393,. Benny grew turnips . How,1394,Gregory starts with and spends $num2,1395,$num1 and spends on Skittles. How,1396,Tim had cents. He paid,1397,cents. He paid cents for a,1398,Joan found seashells and Jessica,1399,and Jessica found seashells on the,1400,Our watermelons have seeds each. If,1401,"If we have watermelons, how many",1402,There are oak trees currently,1403,workers will plant oak trees today,1404,There are apples in a,1405,bag. Scott takes apples out of,1406,cabbage patch has rows of cabbage.,1407,"row, there are heads of cabbage.",1408,", customers buy ear muffs from",1409,", they buy , and there",1410,Mrs. Franklin had Valentines. Mrs. Franklin,1411,Now she has How many Valentines,1412,David weighs pounds. Albert weighs,1413,pounds. Albert weighs pounds. How much,1414,Jonathan starts with cards. He gives,1415,cards. He gives to Barbara. How,1416,The farmer had apples. The farmer,1417,The farmer gave apples to his,1418,Tim has books . Sam,1419,. Sam has books . How,1420,There are crayons in the,1421,drawer. Mary took crayons out of,1422,to the store times last month.,1423,month. She buys blocks each time,1424,boxes that hold each. One day,1425,day it packs oranges. How many,1426,bills her clients dollars per hour,1427,'s case requires hours to complete,1428,Hayley had meatballs on her,1429,Now she has meatballs on her,1430,Phyllis collects crayons. Phyllis's father,1431,father gives Phyllis more. How many,1432,Martha starts with bananas. She loses,1433,bananas. She loses How many bananas,1434,I have pencils. If I,1435,If I put pencils in each,1436,account now has yen and their,1437,account now has yen . How,1438,There are eggs. num2 eggs,1439,are num3 eggs. eggs more are,1440,It took Amanda hours to stroll,1441,Kimberly's house at miles per hour.,1442,It rained inches on Monday.,1443,"Tuesday, it rained inches less than",1444,Deborah is inviting friends to a,1445,party. She has cookies. How many,1446,There are leaves. There are,1447,leaves. There are ladybugs on each,1448,Joan bought dozen eggs from,1449,I have pencils. If I,1450,If I put pencils in each,1451,There are students making num2,1452,num1 students making stars each for,1453,"Lindsey's Vacation Wear, of the garments",1454,are bikinis and are trunks. What,1455,Jesse starts with pencils. He gives,1456,pencils. He gives to Joshua. How,1457,"Olsen's mathematics class, of the students",1458,received A's and received B's. What,1459,Montoya family spends of their budget,1460,groceries and another going out to,1461,Gordon bought pounds of fruit,1462,The class ate pounds of the,1463,There are oranges in each,1464,oranges are in boxes ?,1465,"house, there was inches of snow,",1466,Elementary School received inches of snow.,1467,house. It is miles from Martin's,1468,It took Martin hours to get,1469,Melissa has oranges. John takes,1470,oranges. John takes away. How many,1471,Ann has with blocks. Ann finds,1472,Ann finds another How many blocks,1473,Angela has boxes of tickets.,1474,Each box holds tickets. How many,1475,some peanuts for Craig has $num3,1476,"$num2, Craig has left. How much",1477,Ernest removes apples from a,1478,There were originally apples in the,1479,Annie has marbles. She buys,1480,marbles. She buys more. How many,1481,There were geese and num2,1482,num1 geese and ducks in the,1483,Lillian collects candies. Lillian's father,1484,father gives Lillian more. How many,1485,car company produced cars in North,1486,North America and cars in Europe,1487,'s cat had kittens and num1,1488,'s cat had kittens and num1,1489,. She gave to her friends,1490,Jose has peanuts. Kenya has,1491,peanuts. Kenya has more than Jose.,1492,Each apple costs How much do,1493,How much do apples cost ?,1494,Marie has and Shirley has,1495,and Shirley has How much money,1496,in packages of Nathan ate num2,1497,num3. Nathan ate gumballs. How many,1498,Mike had peaches at his,1499,There are now peaches . how,1500,It takes apples to make,1501,It takes apples to make,1502,Alan starts with bananas. He buys,1503,Alan starts with bananas. He buys,1504,Jonathan has boxes of candies.,1505,Each box holds candies. How many,1506,Jose wandered kilometers at num2,1507,num3 kilometers at kilometers per hour.,1508,recipe calls for cups of flour,1509,already put in cups of flour,1510,There are maple trees and,1511,workers will plant maple trees today,1512,Uncle Dave bought ice cream sandwiches.,1513,"them to his hungry nieces, how",1514,"yesterday, I found frisky fleas having",1515,right ear and baby fleas sleeping,1516,balloons but lost of them .,1517,balloons but lost of them .,1518,Terrell hiked miles on Saturday.,1519,he hiked another miles. How far,1520,There are blocks. num1 blocks,1521,are num3 blocks. blocks more are,1522,Nancy gives to JeŒ´í‰í_rey. If,1523,Nancy started with how much money,1524,She blew up balloons this morning,1525,this morning and balloons this afternoon.,1526,Sam has yellow and 20,1527,. Joan took of Sam 's,1528,There are rulers and 34,1529,. Tim placed rulers in the,1530,Rosa had flowers. Andre gave,1531,"Now, Rosa has flowers. How many",1532,recipe calls for cups of flour,1533,already put in cups of flour,1534,There are walnut trees and,1535,to cut down walnut trees that,1536,Pamela starts with bottle caps. Jean,1537,caps. Jean takes away. How many,1538,eggs are in boxes?,1539,eggs are in boxes?,1540,week Fred had dollars and Jason,1541,and now has dollars . How,1542,Ashley starts with and spends $num1,1543,$num2 and spends on bottle caps.,1544,basketball team has players. Each player,1545,Each player has basketballs. How many,1546,Martha has with blocks. Martha finds,1547,Martha finds another How many blocks,1548,Bridget starts with and spends $num2,1549,$num1 and spends on cards. How,1550,Marcia spent minutes working on,1551,Each chair is dollars. How much,1552,spend for the chairs she bought?,1553,Stephanie ran for hours at num3,1554,num1 hours at miles per hour.,1555,Alyssa has books. Nancy has,1556,books. Nancy has times more books,1557,marbles. She gave to Juan. Now,1558,Now she has marbles left. How,1559,Mrs. Hilt bought pizzas. Each pizza,1560,Each pizza had slices. How many,1561,Mary spent $ on soup and,1562,soup and $ on a salad,1563,Frances has boxes of Skittles.,1564,Each box holds Skittles. How many,1565,Zach scored points in the,1566,game. Ben scored points. How many,1567,Joan found seashells and Jessica,1568,and Jessica found seashells on the,1569,Charles has Skittles. Diana takes,1570,Skittles. Diana takes away. How many,1571,'s family drank carton of regular,1572,regular milk and carton of soy,1573,grant to purchase books . Now,1574,a total of books . How,1575,fish that was of a foot,1576,fish that was of a foot,1577,Heather weighs pounds. Emily weighs,1578,pounds. Emily weighs pounds. Elizabeth weighs,1579,'s sandcastle was feet tall and,1580,sister 's was feet tall .,1581,to the store times last month.,1582,month. He buys bananas each time,1583,Ralph collects cards. Ralph's father,1584,father gives Ralph more. How many,1585,", which is of what its",1586,Mrs. Wong had Valentines. She gave,1587,Valentines. She gave Valentines to her,1588,Earl has crayons. Bridget has,1589,crayons. Bridget has crayons. If Bridget,1590,There are bananas in Diane's,1591,"are organized into groups, how big",1592,John needs He has $num3.,0593,$num20. He has How much more,1594,Rose has apples and num2,1595,num3 apples and erasers. If she,1596,If there are pencils in a,1597,"and Theresa puts more pencils inside,",1598,Gloria weighs pounds. Alan weighs,1599,pounds. Alan weighs pounds. How much,1600,Janice has and Andrew has,1601,and Andrew has How much more,1602,There are butterflies. Each butterfly,1603,Each butterfly has black dots and,1604,the socks for of her family,1605,if she bought cinnamon balls?,1606,There are erasers in a,1607,There are erasers in a,1608,There are Skittles in each,1609,Skittles are in boxes ?,1610,Alyssa had cookies. Aiyanna has,1611,cookies. Aiyanna has How many more,1612,Maggi had packages of cupcakes.,1613,cupcakes. There are cupcakes in each,1614,Tammy has eggs. She gets,1615,eggs. She gets more from Evelyn.,1616,If Benjamin strolled miles at num2,1617,"num1 miles at miles per hour,",1618,There are students in the,1619,the class and apples. If the,1620,Lino picked up shells at the,1621,the morning and shells in the,1622,Darnel sprinted of a lap,1623,break by jogging of a lap.,1624,Kyle jogged laps in P.E.,1625,P.E. class and laps during track,1626,There are bottle caps in,1627,box. Marvin takes bottle caps. How,1628,IsabellaŒŠí_ŒÈs hair is inches long. If,1629,"her hair is inches long, how",1630, of Joe 's,1631,If she pays dollars in taxes,1632,garden snake is inches long. The,1633,boa constrictor is times longer than,1634,If lollipops cost num3,1635,"num1 lollipops cost dollars , how",1636,Virginia has eggs and 8,1637,"the eggs among friends, how many",1638,salon and had inch of hair,1639,asked for another inch to be,1640,There are oranges in a,1641,box. Paula takes oranges. How many,1642,If Joan bicycled miles at num2,1643,"num3 miles at miles per hour,",1644,Willie has and Laura has,1645,and Laura has How much money,1646,Mildred collects oranges. Mildred's father,1647,father gives Mildred more. How many,1648, children were riding,1649,Then there were children altogether on,1650,There are walnut trees currently,1651,there will be walnut trees in,1652,Each child has apples. If there,1653,"If there are children, how many",1654,JesseŒŠí_ŒÈs room is feet long and,1655,feet long and feet wide. How,1656,Alyssa picked pears and Nancy,1657,and Nancy picked pears from the,1658,each booklet has pages and there,1659,each booklet has pages and there,1660,Vegetarian Restaurant bought of a pound,1661,Vegetarian Restaurant bought of a pound,1662,Brian starts with bottle caps. He,1663,caps. He shares with Nathan. How,1664,multi-national corporation has part-time employees and,1665,part-time employees and full-time employees .,1666,Sally bought dozen eggs from,1667,There are short bushes and,1668,workers will plant short bushes today,1669,Marvin gives to Amy. If,1670,Marvin started with how much money,1671,"Fred has green balloons ,",1672,he gave Sandy of the balloons,1673,If she has sunflower seeds and,1674,"and there are cans, how many",1675,Robin has packages of gum.,1676,gum. There are pieces in each,1677,Lansing has elementary schools. There,1678,schools. There are students in each,1679,Each child has stickers. If there,1680,"If there are children, how many",1681,cards. She had cards. She gave,1682,and now has cards left. How,1683,Kyoko pay for balls?,1684,Kyoko pay for balls?,1685,Craig walked of a mile,1686,David's house and of a mile,1687,Each child has apples. If there,1688,"If there are children, how many",1689, birds were sitting,1690,Then there were birds in the,1691,to the store times last month.,1692,month. She buys peanuts each time,1693,Each block costs How much do,1694,How much do blocks cost ?,1695,Jacqueline weighs pounds. Frank weighs,1696,pounds. Frank weighs pounds. How much,1697,she had traveled miles. When she,1